{"acceptance": ["Provider raw references match exactly; only three secret names plus Doppler metadata; read-only token scope and expiry read back independently.", "UID 999 resolves all three names through the installed CLI without logging values; token and expiry metadata protected; temporary resolved values removed.", "Application artifacts and service invocations, packages, boot, media permissions and system timer set unchanged."], "accepted_prerequisite": {"bundle_sha256": "4f7e0a4abbade83ade68f305bd0ca51c450fd803e0877402f0a56ed534c313d3", "execution_review_sha256": "0ca739e73db522164fefe18b461442dfb74df202442abc966eac107a4dd97abc", "terminal_tag": "nautobot-recurring-prerequisites-v1-accepted"}, "baseline": {"artifact_sha256": {"/var/lib/nautobot/.config/containers/systemd/nautobot-migration.container": "2b1b6a4c363baf95f84370f80694eb3d232a99fa6bc416933e62405ac40ecca2", "/var/lib/nautobot/.config/containers/systemd/nautobot-nautobot_media.volume": "ce6a04a71f24fd4c17ad4e39c366e67af2a0affa4c96272d297a3fde36d65e13", "/var/lib/nautobot/.config/containers/systemd/nautobot-postgresql.container": "a2e12b77cf54ac7fc8d9cb7d1699db9b8188d422bbf1aa894ea9497023876684", "/var/lib/nautobot/.config/containers/systemd/nautobot-postgresql_data.volume": "0d570e4cc759483781ac5c4fa2162591d3a60c2978e0be7bfcdb6996ffbe3e7a", "/var/lib/nautobot/.config/containers/systemd/nautobot-private.network": "0bbf16ca337942502efffc0adb6a8694671c16ee143ee83b7b6009cb753fbc63", "/var/lib/nautobot/.config/containers/systemd/nautobot-redis.container": "e07c7c3e89adb7a5c57efa32639cbdea28fc11d04be340a2eabfce0d6faa9aae", "/var/lib/nautobot/.config/containers/systemd/nautobot-redis_data.volume": "b2a22985771b52cac95550657feea845252072a82ec3844f48bcda25666dd717", "/var/lib/nautobot/.config/containers/systemd/nautobot-scheduler.container": "7dde40f84c637dd79ec5859cf9a17ec9e68b2e111d647a39a8987e7c7cb248db", "/var/lib/nautobot/.config/containers/systemd/nautobot-web.container": "c8adc29062e82fdf5d524eb339b312b66611e81085d06235df658e5cce5a2e76", "/var/lib/nautobot/.config/containers/systemd/nautobot-worker.container": "d01b0ed26ea2b9228c3b126aac6d9e4329faec41eb0ac644245d6f4c9e9d989d", "/var/lib/nautobot/runtime/initialize-application.py": "4f7126411510e7d7a5d0abb940b4cca0f62ed0476b237700573e13974c0ca78b", "/var/lib/nautobot/runtime/startup-application.py": "59ec7f31b177187ac3c653e99ca8087e32578a0cab3b633dee39d48a09a0021e", "/var/lib/nautobot/runtime/startup-command.py": "701061362ce1fc9b24c36fa8cc2d78eb9c100f5e8a13d9f63c6034d76ccea606", "/var/lib/nautobot/runtime/startup-job-probe.py": "07d35ced450e972c08e55a9bc195573e9e1b440db5fb3f676947748e6105042c", "/var/lib/nautobot/runtime/startup-job.py": "85e9ad36f04975a7c72426d92d31c91a36c0b5045d2c6010eef91b1a61c029e6"}, "mapped_media": {"/var/lib/nautobot/.local/share/containers/storage/volumes/nautobot-nautobot_media": {"exists": true, "gid": 166534, "mode": "0700", "symlink": false, "uid": 166534}, "/var/lib/nautobot/.local/share/containers/storage/volumes/nautobot-nautobot_media/_data": {"exists": true, "gid": 166534, "mode": "0755", "symlink": false, "uid": 166534}}}, "boundaries": {"application_credentials": false, "canonical_secret_changes": false, "capture": false, "notifications": false, "packages": false, "reboot": false, "service_changes": false, "timers": false}, "delivery": {"directory": "/var/lib/nautobot/protection/credentials", "directory_mode": "0700", "file_mode": "0600", "metadata_file": "/var/lib/nautobot/protection/credentials/metadata.json", "token_file": "/var/lib/nautobot/protection/credentials/doppler-service-token"}, "external_inputs": ["Existing authenticated controller Doppler session with authority to create the dedicated config and read-only token; no credential values in the bundle.", "Provider supports cross-config references; canonical source names and empty parent are checked during the approved preflight.", "Working SSH and passwordless sudo for ama at the exact target; existing host key verification retained."], "later_stages": ["capture_and_independent_resume_qualification", "notification_delivery_test", "schedule_enablement"], "operation": {"authorization_ready": true, "execution_enabled": true, "id": "nautobot-recurring-credentials-v1", "source_commit": "73417cb73fba6ac185b67d6d2b848b5fba69845c", "stage": "recurring_credential_provisioning", "state": "pending"}, "plan_sha256": "3e1c74a76468ed75b12739718fc93481450968234c91630b4a4ad6d1cba9c876", "provider": {"access": "read", "config": "prd_nautobot_backup", "environment": "prd", "max_age": "2160h", "metadata_names": ["DOPPLER_CONFIG", "DOPPLER_ENVIRONMENT", "DOPPLER_PROJECT"], "parent": "prd", "project": "homelab-dev", "references": {"NAUTOBOT_RESTIC_B2_APPLICATION_KEY": "${homelab-dev.prd_b2.NAUTOBOT_RESTIC_B2_APPLICATION_KEY}", "NAUTOBOT_RESTIC_B2_APPLICATION_KEY_ID": "${homelab-dev.prd_b2.NAUTOBOT_RESTIC_B2_APPLICATION_KEY_ID}", "NAUTOBOT_RESTIC_REPOSITORY_PASSWORD": "${homelab-dev.prd_restic.NAUTOBOT_RESTIC_REPOSITORY_PASSWORD}"}, "rotation_lead_days": 14, "rotation_owner": "Aaron (homelab operator)", "token_name": "nautobot-recurring-backup"}, "rollback": ["Revoke only the newly returned token slug; remove only the newly created host credential files and empty directory.", "Retain a newly created provider config for manual review on failure; ambiguous create responses or failed revocation require manual intervention. No blind retries or deletion of pre-existing state."], "schema_version": 1, "target": {"address": "10.1.2.170", "gid": 985, "host": "j2-svpi4mf", "ssh_user": "ama", "uid": 999}}
